{
  "version": 1,
  "updatedAt": "2026-10-06T09:45:16.488Z",
  "taskId": "INV-009",
  "status": "dispatched",
  "sourceState": "READY",
  "conversationId": "088aeec5d1544fcdb0e5f6278f0c5cd2",
  "startTaskId": "088aeec5d1544fcdb0e5f6278f0c5cd2",
  "dispatchedAt": "2026-10-06T09:45:16.488Z",
  "reason": null
}
